listing_id, name, description
1, Impedit velit quo nobis minus occaecati., Laboriosam consequatur voluptatum exercitationem accusantium dolorem aut exercitationem.
2, Facilis minus vitae debitis natus fugiat quas., Sed ipsum quia officiis expedita corrupti culpa labore.
3, Ut placeat reprehenderit molestiae quis molestiae sit., Ab ratione rerum.
4, Aliquid id nulla velit., Soluta vero voluptas.
5, Qui dolorem eum labore alias voluptatem placeat aperiam., At debitis porro modi nisi ipsa voluptatem ipsam qui voluptas.
6, Earum tenetur sit nisi voluptate., Vel quis vel unde quia officia consequatur rerum sit.
7, Dolores fugiat veritatis sunt est ut ut sit., Beatae eaque atque quia est ut asperiores dicta qui quasi.
8, Est dolorem nostrum., Molestiae animi dolorem sunt omnis a dolor.
9, Dicta sed quia qui eos dolor unde natus dolorem., Ut quo excepturi harum minima autem esse.
10, Officiis eum repellat quos velit et ut autem., Eos debitis facilis.
11, Sapiente vero vitae cum rerum est voluptatem voluptatem et., Repellendus consequatur et porro culpa ipsam voluptas.
12, Ipsum corporis eos esse voluptatem rerum error., Error ut quos qui reprehenderit pariatur et.
13, Porro non doloremque maxime labore optio maiores qui., Fuga placeat nam iure saepe illum asperiores enim odio.
14, Aut occaecati ab., Mollitia voluptatem aliquam nisi consequuntur et culpa.
15, Veritatis vel earum vel rerum., Quas ab ipsum.
16, Sit et officia dolorum cum quo., Ut repellendus molestias odit omnis exercitationem.
17, Doloremque omnis et praesentium molestiae., Veritatis assumenda perspiciatis distinctio sint laborum ut nisi et.
18, Suscipit impedit aliquam., Harum dicta sed laudantium.
19, Sunt sunt officia., Sed sapiente culpa quo temporibus.
20, Eligendi incidunt tenetur facilis., Neque repellendus asperiores nemo perspiciatis itaque.
21, Cumque beatae quia maxime ut quibusdam voluptates officiis non., Eos voluptatem accusantium consequatur libero ullam quis.
22, Velit dignissimos est magnam est labore., Molestiae illum qui rerum quod quia odit provident ducimus voluptate.
23, Magni velit sed dolorum a., Praesentium velit quidem qui quidem possimus suscipit.
24, Nobis quis aperiam voluptates nam., Quos expedita eius soluta aspernatur qui eum.
25, Corrupti laborum quisquam quia exercitationem soluta sunt nihil., Aperiam in est qui architecto dolor.
26, Porro molestias consectetur amet vel est autem soluta sunt aspernatur., Omnis occaecati consequuntur impedit enim reprehenderit sit temporibus illum.
27, Inventore id nostrum accusantium dolor consequatur., Maiores animi expedita quae occaecati enim non.
28, Iure ex nostrum veritatis dolor commodi commodi fuga suscipit odio., Quia dolor iste doloribus.
29, Nihil ipsum voluptatibus dolore voluptatum ut provident assumenda., Occaecati aut et cumque dicta.
30, Quia magnam quo sunt nobis commodi necessitatibus quidem corrupti sint., Amet quisquam harum non dolore.
31, Eos consectetur voluptas culpa id., Quo tempore delectus iure exercitationem praesentium qui excepturi.
32, Quo quas dolorum veritatis veritatis., Odio sapiente inventore ut et sint.
33, Reiciendis exercitationem est minus est labore ducimus praesentium asperiores quis., Deserunt voluptas est et error deleniti quae.
34, Deserunt veritatis molestiae., Temporibus veniam consectetur.
35, Officiis omnis nisi nesciunt voluptatem iure ea tenetur soluta., Mollitia accusantium id quaerat veritatis.
36, Perferendis nisi voluptas exercitationem ut cumque quia., Labore est consequatur eum.
37, Veritatis iste exercitationem mollitia omnis voluptates nihil consequuntur., Totam nihil quibusdam qui laboriosam qui.
38, Beatae doloribus et itaque et ex architecto hic labore iste., Quibusdam aut dolorum numquam dolore magnam sapiente et voluptate.
39, Sequi quia tenetur voluptatem placeat ratione deleniti., Et vitae quaerat.
40, Laudantium aut aliquid quis qui corporis consequatur et libero., Qui sunt sed labore.
41, Possimus voluptatem necessitatibus magnam dolorum., Asperiores voluptatem aliquam.
42, Animi alias a animi eligendi delectus qui reiciendis et., Blanditiis vel in nam deleniti voluptatum.
43, Perspiciatis vel nostrum., Quisquam dolore qui est quia consectetur totam itaque ut vel.
44, Iure repellendus sed nihil ut tempora., Non quasi voluptas autem sit exercitationem.
45, Pariatur neque repellat sit vitae nostrum quibusdam qui., Eveniet omnis eum non vero.
46, Eum id unde pariatur voluptas fugit soluta voluptates., Illum consequuntur repellat sed occaecati.
47, Magni voluptatem et sit nostrum fugiat atque., Dolorem eveniet est ipsa cupiditate.
48, Voluptatem molestias tempore quaerat., Aut est asperiores quia et minus pariatur eveniet.
49, Provident autem enim dolorem dolor a qui., Ratione iste sit consectetur sunt quas accusantium.
50, Quae commodi delectus numquam odit dicta quaerat ab., Incidunt aliquam tempore iste aspernatur distinctio.
51, Blanditiis nihil quisquam facere quo fuga mollitia voluptatibus ducimus beatae., Quia id et et sunt eius aperiam.
52, Porro rerum culpa velit., Est qui enim enim totam rem magnam.
53, Aliquam voluptates qui sequi ad quam nihil voluptas., In facilis at.
54, Ad natus consectetur ipsa qui nihil., Recusandae quaerat aliquam sit odit doloremque veniam aspernatur.
55, Ipsam amet labore et incidunt quis., Provident qui adipisci.
56, Corporis ut sequi quis omnis incidunt sed., Et sit non in sit.
57, Adipisci et earum pariatur nam est et est aut., Minus totam et.
58, Fugiat nihil consequatur consectetur qui soluta iusto nulla id aperiam., Dolore ducimus sint et voluptas non.
59, Perferendis consequuntur iure incidunt quo est., Quo porro accusamus eius maxime error vel esse.
60, Quos tenetur officia non odit ut sed et ut., Aspernatur animi quisquam temporibus.
61, Ducimus modi sed ut saepe commodi omnis totam., Beatae ut consequatur voluptatum.
62, Et harum dolorem error officia dolores aut voluptas sed., Molestiae neque architecto tempore quae.
63, Qui exercitationem quae ut., Saepe ut corporis.
64, Nihil quidem quo consequatur vel iure distinctio accusantium nihil., Et vel deleniti dolores consequuntur.
65, Iure ipsa numquam., Labore voluptatem incidunt inventore repellendus temporibus.
66, Quaerat facilis ut eum dolore., Quos vel tempore illum ratione enim eaque dignissimos.
67, Qui et vitae voluptate commodi sit corporis rerum nesciunt molestiae., Ratione et consectetur.
68, Dolorem dolorem dolor., Non tenetur eum in.
69, Iusto illum libero eius magnam natus voluptatem deleniti ut asperiores., Sunt perspiciatis illum odit minima.
70, Incidunt sed nam ut earum sint hic facilis autem dolores., Quod consectetur ut.
71, Soluta assumenda expedita sunt fugit delectus., A perspiciatis maxime mollitia hic sit commodi deserunt.
72, Tempore iusto voluptas veniam expedita., Magnam eum ullam.
73, Eos ex autem quibusdam qui ducimus repellat natus est dolorem., Sapiente sunt nam qui delectus.
74, Quos cum occaecati et vero vel praesentium eos non non., Recusandae expedita consequatur.
75, Nihil ut quo., Quae facere est illum harum repudiandae repellendus quas possimus.
76, Rerum adipisci aut dolor error corrupti., Beatae vitae fuga.
77, Rerum similique deleniti recusandae qui., Eligendi aliquam est et ducimus excepturi at sint dolorem fugit.
78, Quae in occaecati et molestiae., Qui corporis in exercitationem.
79, Ut beatae eum., Illum qui et qui fugit consequuntur autem.
80, Similique necessitatibus deserunt eaque consequatur molestiae porro voluptate neque., Facere tempore assumenda atque velit temporibus reprehenderit dicta molestiae sed.
81, Beatae iure velit., Consectetur modi occaecati dolor neque.
82, Magni velit rerum tempora inventore nihil quam quia dolore., Modi est sint ipsam tempora sed aperiam quia.
83, Magni praesentium nobis occaecati., Ea sed veritatis.
84, Qui non nesciunt aut sit doloribus eius id hic ea., Quod sit est maiores molestiae vitae voluptatum.
85, Sit cupiditate ullam labore inventore natus., Dolorem et est qui dolor ut.
86, Facilis esse doloribus excepturi accusamus alias., Corporis aspernatur aliquid ex minima libero harum soluta qui quia.
87, Doloremque facilis at provident., Molestiae saepe ea et ratione.
88, Magni est id omnis., Hic consequatur nesciunt.
89, Itaque molestiae vel similique ea excepturi., Et unde accusantium laborum ut rerum omnis in.
90, Qui qui nihil a eos ut., Sed velit reprehenderit odio quia sapiente labore sed ut veniam.
91, Sunt est soluta quia consequatur dicta voluptatem iure., Porro voluptatibus autem amet quod.
92, Molestiae ea at accusamus aperiam voluptas., Provident voluptas maxime perferendis harum sit ut ad doloribus.
93, Sit non provident itaque occaecati quisquam sed., Voluptate aut soluta qui qui eum eaque nemo non.
94, Et facilis autem delectus doloribus., Unde voluptate enim ducimus dolorem aut.
95, Quia ullam et voluptas et eum aut aliquid., Quaerat qui enim.
96, Consequatur culpa omnis aut quos exercitationem sequi ut., Nostrum sit maxime accusantium adipisci minima saepe ut voluptatem sint.
97, Neque totam iste nemo voluptatem consequuntur., Et veritatis voluptates voluptas.
98, Eos quo sed., Ea itaque eaque aut omnis quo.
99, Nam eaque praesentium et aut labore rerum., Ipsam laboriosam repellat reprehenderit quia eum expedita aut.
100, Autem et vel et deleniti in quo., Natus in explicabo voluptate deleniti id animi porro sed.
